{
  "artifacts": [
    {
      "artifact_id": "MISSION_SPEC",
      "hash": "sha256:d9722748f3fd6e45ca8b470594bea9dd379949b952a3e00cde793e1d97cb5154",
      "path": "mission_spec.canonical.json",
      "required_for_replay": true,
      "type": "mission_spec"
    },
    {
      "artifact_id": "VALIDATION_REPORT",
      "hash": "sha256:ee6ad46e96143ce457c8bd9bbd5309c26feba8abebf3e88aa5afea03dbdd6c9e",
      "path": "validation_report.json",
      "required_for_replay": true,
      "type": "validation_report"
    },
    {
      "artifact_id": "COMPILE_RESULT",
      "hash": "sha256:7de6c626123cac77de3538164d0684425953f83f87ff824bff6c1500bcbd9add",
      "path": "compile_result.json",
      "required_for_replay": true,
      "type": "compile_result"
    },
    {
      "artifact_id": "PYTHON_SCRIPT",
      "backend": "gmat",
      "hash": "sha256:f7f40e3f29bc61f16b03bd587b0d79867e721f14b81732ae55f81858b4d11660",
      "path": "generated_mission.py",
      "required_for_replay": true,
      "type": "python_script"
    },
    {
      "artifact_id": "GMAT_SCRIPT",
      "backend": "gmat",
      "hash": "sha256:611025031f7f69e86f12a7d4d1d06b4ac7aed712bbb3ca0cebb2f3d6fac63570",
      "path": "generated_mission.script",
      "required_for_replay": false,
      "type": "native_script"
    }
  ],
  "bundle_id": "MEO_demo_bundle",
  "created_at": "2026-06-15T01:26:11.697800+00:00",
  "mission_id": "MEO_demo",
  "provenance": {
    "compiler_version": "0.1.0",
    "generated_by": "mission-mvp"
  },
  "schema_version": "1.0.0"
}
