{
  "artifacts": [
    {
      "artifact_id": "MISSION_SPEC",
      "hash": "sha256:170299b25f725a3c0446efda64575558b040dd694901206fec723519168cf186",
      "path": "mission_spec.canonical.json",
      "required_for_replay": true,
      "type": "mission_spec"
    },
    {
      "artifact_id": "VALIDATION_REPORT",
      "hash": "sha256:fabadb4303190f86d6b480700bfc634ae32e424b5da0f648f050b27a15bacd6b",
      "path": "validation_report.json",
      "required_for_replay": true,
      "type": "validation_report"
    },
    {
      "artifact_id": "COMPILE_RESULT",
      "hash": "sha256:ee6db4bcff488924986b7fdbc2d226d15d9b43cb83660d9270d3f8992e1b8a4f",
      "path": "compile_result.json",
      "required_for_replay": true,
      "type": "compile_result"
    },
    {
      "artifact_id": "PYTHON_SCRIPT",
      "backend": "gmat",
      "hash": "sha256:8edf99de0d9a59aa8e63999da88bc02911c33879ca3b9c38080e9d5becff3157",
      "path": "generated_mission.py",
      "required_for_replay": true,
      "type": "python_script"
    },
    {
      "artifact_id": "GMAT_SCRIPT",
      "backend": "gmat",
      "hash": "sha256:559de66f4f3c8b50661c0e8cca2a359d84d6ffeb16a59f961364dbcf86fa8285",
      "path": "generated_mission.script",
      "required_for_replay": false,
      "type": "native_script"
    }
  ],
  "bundle_id": "elliptical_LEO_to_GEO_bundle",
  "created_at": "2026-06-17T18:50:26.762067+00:00",
  "mission_id": "elliptical_LEO_to_GEO",
  "provenance": {
    "compiler_version": "0.1.0",
    "generated_by": "mission-mvp"
  },
  "schema_version": "1.0.0"
}
